{
    "$schema": "http://json-schema.org/draft-04/schema#",
    "type": "object",
    "properties": {
        "_id": {
            "type": "string"
        },
        "name": {
            "type": "string"
        },
        "shortName": {
            "type": "string"
        },
        "comments": {
            "type": "array",
            "items": {
                "type": "string"
            }
        },
        "tags": {
            "type": "array",
            "items": {
                "type": "string"
            }
        },
        "questions": {
            "type": "array",
            "items": {
                "type": "object",
                "properties": {
                    "comparableText": {
                        "type": "string"
                    },
                    "description": {
                        "type": "string"
                    },
                    "status": {
                        "type": "string"
                    },
                    "dimension": {
                        "type": "string"
                    },
                    "choiceFreeText": {
                        "type": "boolean"
                    },
                    "choices": {
                        "type": "array",
                        "items": {
                            "type": "object",
                            "properties": {
                                "value": {
                                    "type": "string"
                                },
                                "weight": {
                                    "type": ["number", "null"]
                                }
                            },
                            "additionalProperties": false,
                            "required": [
                                "value"
                            ]
                        }
                    },
                    "customCodes": {
                        "type": "array",
                        "items": {
                            "type": "object",
                            "properties": {
                                "code": {
                                    "type": "string"
                                },
                                "vendor": {
                                    "type": "string"
                                }
                            },
                            "additionalProperties": false,
                            "required": [
                                "code",
                                "vendor"
                            ]
                        }
                    },
                    "comments": {
                        "type": "array",
                        "items": {
                            "type": "string"
                        }
                    },
                    "tags": {
                        "type": "array",
                        "items": {
                            "type": "string"
                        }
                    }
                },
                "additionalProperties": false,
                "required": [
                    "comparableText"
                ]
            }
        },
        "languages": {
            "type": "array",
            "items": {
                "type": "object",
                "properties": {
                    "language": {
                        "type": "object",
                        "properties": {
                            "name": {
                                "type": "string"
                            },
                            "code": {
                                "type": "string"
                            }
                        },
                        "additionalProperties": false,
                        "required": [
                            "name",
                            "code"
                        ]
                    },
                    "variables": {
                        "type": "array",
                        "items": {
                            "type": "object",
                            "properties": {
                                "placeholder": {
                                    "type": "string"
                                },
                                "description": {
                                    "type": "string"
                                },
                                "choices": {
                                    "type": "array",
                                    "items": {
                                        "type": "string"
                                    }
                                }
                            },
                            "additionalProperties": false,
                            "required": [
                                "placeholder",
                                "choices"
                            ]
                        }
                    },
                    "questions": {
                        "type": "array",
                        "items": {
                            "type": "object",
                            "properties": {
                                "comparableText": {
                                    "type": "string"
                                },
                                "text": {
                                    "type": "string"
                                },
                                "explanation": {
                                    "type": "string"
                                },
                                "group": {
                                    "type": "string"
                                },
                                "part": {
                                    "type": "string"
                                },
                                "elaboration": {
                                    "type": "object",
                                    "properties": {
                                        "text": {
                                            "type": "string"
                                        },
                                        "reference": {
                                            "type": "string"
                                        }
                                    },
                                    "additionalProperties": false,
                                    "required": [
                                        "text"
                                    ]
                                },
                                "choices": {
                                    "type": "array",
                                    "items": {
                                        "type": "object",
                                        "properties": {
                                            "value": {
                                                "type": "string"
                                            },
                                            "text": {
                                                "type": "string"
                                            }
                                        },
                                        "additionalProperties": false,
                                        "required": [
                                            "value"
                                        ]
                                    }
                                }
                            },
                            "additionalProperties": false,
                            "required": [
                                "comparableText",
                                "text"
                            ]
                        }
                    }
                },
                "additionalProperties": false,
                "required": [
                    "language",
                    "variables",
                    "questions"
                ]
            }
        }
    },
    "additionalProperties": false,
    "required": [
        "name",
        "shortName",
        "questions",
        "languages"
    ]
}
